company,postContent,postUrl
PLD Space,"ME m0  @ Anunciamos que PLD Space ha obtenido un préstamo de COFIDES de 11 millones de euros para impulsar la base de lanzamiento de MIURA 5 en Kourou.  En total, nuestra inversi6n inicial ascienda a 16 millones de euros en este complejo de lanzamiento, situado en el puerto espacial europeo CSG, en Kourou (Guayana Francesa), propiedad de la Agencia Espacial Francesa (Centre National d'Etudes Spatiales) y la Agencia Espacial Europea (European Space Agency - ESA).  ‘Agradecemos la confianza en nuestra misién de dotar a Europa de una capacidad de acceso al espacio total, fortaleciendo las infraestructuras europeas estratégicas de espacio.  Consulta aqui toda la informacién https://bit.ly/3ZzR61n  @ We announce that PLD Space has secured an €11 million loan from COFIDES to accelerate the development of the MIURA 5 launch site in Kourou.  ‘We will initially invest a total of €16 million in this launch base, located at the CSG - Europe's spaceport in Kourou- operated by Centre National d'Etudes Spatiales and European Space Agency - ESA.  We appreciate the confidence in our mission to provide Europe with a complete launch capability, strengthening European strategic space infrastructure.  More info is available here https://bit.ly/3ZxGGPG  Show translation",https://www.linkedin.com/posts/pld-space_anunciamos-que-pld-space-ha-obtenido-activity-7269304383383764992-526h?utm_source=share&utm_medium=member_desktop&rcm=ACoAAFsyZUYBH2tDEsbgneW-xiicuGyTwj5RqN8
PLD Space,"The final application submission stage for our SPARK program is now clo  We are thankful for the warm reception of this initiative, which ultimately aims to address Earth's challenges through space-based solutions offering final no-cost launch services on our MIURA 5 Maiden Flight.  In total we've received 111 applications from 27 di Germany, UK, USA, Australia, Japan, and Argentina.  The type of submissions is extremely varied and feature a high level of maturit : 30% from school and high school students groups, 30% from commercial  18% from universities, 8% from research centers, and the rest from  . Moving now onto the next stage! Stay tuned!  #spaceeducation #spaceinnovation  PLDSPACE  MIURA S SPARK PROGRAM  Sparking space-based innovation by younger generations  APPLICATIONS NOW _ EGLOSED!  111 27 34  applications countries. educational projects",https://www.linkedin.com/posts/pld-space_spaceeducation-spaceinnovation-activity-7268236633160773632-934z?utm_source=share&utm_medium=member_desktop&rcm=ACoAAFsyZUYBH2tDEsbgneW-xiicuGyTwj5RqN8
PLD Space,"BS ow  We've hit more than 250!  We're excited to share that PLD Space has officialy reached the milestone of 262 team members, a growing solid team encouraged to push their boundaries day by day.  This achievement wouldn't have been feasible without the collective effort of our managers and leaders. Shoutout to our People & Culture superstars for their dedication to supporting our growth from 200 to 262 in just 6 months!  The journey continues... We're hiring +40 roles across business, engineering, testing and production, Don't miss the chance to be a part of our next chapter  https://Inkd.in/dqZtseS4  €€0 1,189 31 comments - 30 reposts  ® Like © Comment 1% Repost 7 Send",https://www.linkedin.com/posts/pld-space_weve-hit-more-than-250-were-excited-activity-7266777466654896129-stac?utm_source=share&utm_medium=member_desktop&rcm=ACoAAFsyZUYBH2tDEsbgneW-xiicuGyTwj5RqN8
PLD Space,"As part of our commitment with younger generations, our SPARK program was born just a few months ago to inv ities, institutions and from all from free launch services on our future MIURA 5 Maiden Flight.  ‘Today we are happy to announce that we have so far received 108 applications from 24 different countries and the number of applications is still growing at this stage.  jed to extend the final application deadline until November 29th.  ur application by visiting https://Inkdl.in/dCr-Tyuq  PLDSPACE MIURA © SPARK PROGRAM  Final Application Deadline is extended until  November 29, 2024  Apply by visiting www:spark-programpldspace.com",https://www.linkedin.com/posts/pld-space_as-part-of-our-commitment-with-younger-generations-activity-7262780415151669249-2Dzy?utm_source=share&utm_medium=member_desktop&rcm=ACoAAFsyZUYBH2tDEsbgneW-xiicuGyTwj5RqN8
PLD Space,"We are hiring!  are looking for an experienced Propulsion Test Engineer to take ownership and  rt the development of the our engin , including the continuous improvement and maintenance of our test sites. If you like to tackle challenging projects in a vibrant working environment, apply for the vacancy below:  PLDSPACE  WE ARE HIRING! Propulsion Test > Engineer  Boost your-eareer.in. space by designing rigs)for powertrain subsystems;engine or battery to be installediinytest facilities  Joins now!  pidspacecom/career",https://www.linkedin.com/posts/pld-space_spacetalent-activity-7259942446799736832-LYAb?utm_source=share&utm_medium=member_desktop&rcm=ACoAAFsyZUYBH2tDEsbgneW-xiicuGyTwj5RqN8
PLD Space,"> | PLD Space  E Really proud to have been announced as a newcomer to join the European Innovation Council's at the Scale 100 Forum, held in Athens last week. The Club aims to accelerate the growth of all its members, with a goal of scaling 20% of them into unicorns.  United, we can turn that into reality ls  Read full news article below  BB Agradecidos de haber sido seleccionados por el del Consejo Europeo de Innovacién en el Scale 100 Forum, celebrado en Atenas la semana pasada. Este club pretende acelerar el crecimiento de todos sus miembros, con el objetivo de que el 20% de ellos se conviertan en unicornios.  Unidos, podemos convertirlo en realidad bo  Puedes leer el articulo completo aqui —  Show translation  PLDSPACE",https://www.linkedin.com/posts/pld-space_really-proud-to-have-been-announced-as-activity-7256615510107144193-nPvS?utm_source=share&utm_medium=member_desktop&rcm=ACoAAFsyZUYBH2tDEsbgneW-xiicuGyTwj5RqN8
PLD Space,"CeO 121 3 comments - 7 reposts  ® Like © Comment 1% Repost J Send  > | PLD Space + Follow 60,170 followers mo ©  El préximo martes tendremos el placer de formar parte de FITEA - Forum de Innovaci6n, Talento y Educacién Aeroespacial, uno de los principales escaparates de innovacién, educacién y talento en el sector aeroespacial.  A través de la ponencia ""La motivacién mas alld de la carrera universitaria’, Jose Andrés Sanchez-Bueno, Chief People & Culture Officer, nos mostraré cémo en PLD Space estamos impulsando una cultura sélida centrada en valores y nos hablaré de aquellas competencias y aptitudes profesionales necesarias hoy en dfa para desarrollar equipos de alto rendimiento en la industria aeroespacial.  iTe esperamos!  #spacetalent  Show translation  >PLDSPAC  Impact Tal Octubre 29, 2024 La motivacion mas alla de la carrera  © 1240-13.00 pm(cet)  G) Jose Andrés Sanchez  €€@079 14. comment - 5 reposts",https://www.linkedin.com/posts/pld-space_spacetalent-activity-7255538050284343296-Gf6v?utm_source=share&utm_medium=member_desktop&rcm=ACoAAFsyZUYBH2tDEsbgneW-xiicuGyTwj5RqN8
PLD Space,"> | PLD Space + Follow  Meet us at the #SVSW MilSat Symposium, the must-attend event for next-gen space defense in the United States.  ‘ Feel invited to attend the panel ‘DoD Launch Service Procurement Process and Future Readiness Requirements, where our Chief Strategy & Public Affairs  Officer, Anibal Villalba Fernandez, will address with other industry players the technological, logistical and financial understandings needed to build next-generation space defense synergies.  Check details of the panel discussion below See you all there!  #MilSatSymposium #MilSat  >PLDSPAC!  October 24, 2024 DoD Launch Services  Procurement and Future ¢ Perrier Readiness Requirements SYMPOSIUM  © 200-140 Pm esr)  @) Anibal Villalba ‘Chet Strategy & Pubic Afr OF  ec  3 comments - 1 repost  ® Like © Comment 1% Repost 7 Send  ly | PLD Space + Follow",https://www.linkedin.com/posts/pld-space_svsw-milsatsymposium-milsat-activity-7254485133980823553-9IrY?utm_source=share&utm_medium=member_desktop&rcm=ACoAAFsyZUYBH2tDEsbgneW-xiicuGyTwj5RqN8
PLD Space,"oF PONOw  Come and join us next week at Satellite Innovation Symposium in Silicon Valley! You are invited to attend the panel ""Launch: What Surprises Await in Delivering the Next Era of Space Capacity2"", where Pablo Gallego Sanmiguel, our VP of Sales & Customers, will discuss with other industry players about the future of the global launcher industry.  If you would also like to meet us in person, book a meeting with us here: https://bit.ly/4041bEI  See you all there!  Silicon Valley Space Week  #SVSW#SVS W #SVSW #SatelliteInnovation #MilSatSymposium #Spacelndustry #Networking #Inr  >PLDSPACE  October 22, 2024  Await in Delivering the  Next Era of Space SATELLITE Capacity? INNOVATION  © 240-325 Pm (esr  9) Pablo Gallego oF les &  C657 1. comment - 2 reposts  ® Like © Comment 1% Repost 7 Send",https://www.linkedin.com/posts/pld-space_svsw-satelliteinnovation-milsatsymposium-activity-7252988159280435200-cAYV?utm_source=share&utm_medium=member_desktop&rcm=ACoAAFsyZUYBH2tDEsbgneW-xiicuGyTwj5RqN8
PLD Space,"La presidenta de Fundacién Cotec para la Innovacién, Cristina Garmendia Mendizabal, y su director general, Jorge Barrero Fonticoba @, nos han visitado esta semana en nuestros HQ para conocer de primera mano el proceso de desarrollo y fabricacién del lanzador MIURA 5, asf como avanzar en el intercambio de conocimiento como motor del desarrollo econémico y social.  iUn placer recibiros en casa!  Show translation",https://www.linkedin.com/posts/pld-space_la-presidenta-de-fundaci%C3%B3n-cotec-para-la-activity-7252680520906510337-M8H0?utm_source=share&utm_medium=member_desktop&rcm=ACoAAFsyZUYBH2tDEsbgneW-xiicuGyTwj5RqN8
PLD Space,"ee  5 comments - 9 reposts  6€0487  Like © Comment Repost J Send  > | PLD Space + Follow f Tmo» ®  Join us next week at the renowned IAC 2024 in Milan!  You are warmly invited to meet in person our sales senior management team at hall Space Spain by ICEX. We'll be more than excited to discuss with you all MIURA 5 flight opportunities and our recently-announced future vision on space transportation  We look forward to meeting you there!  >PLDSPAC!  Meet us at October 14 - 18, 2024 IAC 2024!  Pablo Gallego  1 comment - 2 reposts  Like © Comment Repost J Send  + Follow",https://www.linkedin.com/posts/pld-space_join-us-next-week-at-the-renowned-iac-2024-activity-7250174023932796929-R9Lk?utm_source=share&utm_medium=member_desktop&rcm=ACoAAFsyZUYBH2tDEsbgneW-xiicuGyTwj5RqN8
PLD Space,"BB Proud to announce that this week we have bs fed by Endeavor's ISP pane  in Dublin as one of their global high-impact eneurs. Being the first spa up company to be part of the network, this alliance that will enable us to build on our \n to drive sustainable value for the future from space.  Read full related news arti  BB Nos enorgullece anunciar que hemos sido seleccionados por el panel ISP  de Endeavor en Dublin como uno de sus emprendedores globales de alto impacto. iendo la primera up’ espacial en formar parte de esta prestigiosa red, esta  alianza nos permitiré avanzar en nuestra misién de aportar valor sostenible para el  futuro desde el espacio.  Puedes leer aqui el articulo completo en espafiol —https://bit.ly/4gBOmH9  >PLDSPACE  PART OF THE  ENDEAVOR NETWORK",https://www.linkedin.com/posts/pld-space_proud-to-announce-that-this-week-we-have-activity-7245033823292317697--Q3j?utm_source=share&utm_medium=member_desktop&rcm=ACoAAFsyZUYBH2tDEsbgneW-xiicuGyTwj5RqN8
PLD Space,"Esta semana estaremos presentes como patrocinadores Plata en New Space Espafia, uno de los eventos emergentes més relevantes del sector espacio a nivel nacional.  Tanto Cesar Bernal, Sales & Customers Manager, como Pablo Gallego Sanmiguel, VP of Sales & Customers, participaran ademés en diferentes paneles aportando nuestra visién sobre liderazgo y oportunidades de desarrollo en el espacio europeo.  Si deseas saber mas sobre nuestro futuro servicio de lanzamiento MIURA 5 y el programa SPARK, puedes agendar una cita aqui} bit.ly/3Xxh6YZ  iTe esperamos!  Show translation  >PLDSPACE  Meet us at New Space ‘September 26-27, 2024 Espana 2024!  Pablo Gallego  1 comment - 6 reposts  ® Like © Comment 1% Repost 7 Send  > | PLD Space + Follow 60,170 rs 8mo+®  Meet us next week at World Satellite Business Week (WSBW) in Paris!",https://www.linkedin.com/posts/pld-space_esta-semana-estaremos-presentes-como-patrocinadores-activity-7243944319458394112-QpqO?utm_source=share&utm_medium=member_desktop&rcm=ACoAAFsyZUYBH2tDEsbgneW-xiicuGyTwj5RqN8
PLD Space,"> | PLD Space + Follow 60,170 8mo+®  Meet us next week at World Satellite Business Week (WSBW) in Paris!  You are warmly invited to attend the panel discussion “Thrust and Trust: Enabling Space Transportartion”, where Ratil Verdui, our co-founder and CBDO, will speak about our flight-proven launcher tech and how we are evolving at speed and scale our MIURA 5 program 3""  you also want to meet us in person, get in touch with Pablo Gallego Sanmiguel, VP of Sales and Customers, and book a meeting with us here:  https://le.cx/fmhUyD  See you all there!  >PLDSPACE September 18, 2024 Panel Di Thrust and Trust: Enabling Space E SaTetuire Business  Transportation week  (© 520-610 Pm(cest)  Ragl Verda (Co-founder &: cat  €€0 103 2 comments - 4 reposts  ® Like © Comment 1% Repost 7 Send  PLD Space + Follow",https://www.linkedin.com/posts/pld-space_meet-us-next-week-at-world-satellite-business-activity-7240278570432909312-vKT1?utm_source=share&utm_medium=member_desktop&rcm=ACoAAFsyZUYBH2tDEsbgneW-xiicuGyTwj5RqN8
PLD Space,"ME emo ""2 Abrimos la convocatoria para centros de educacién primaria, secundaria y FP a nuestro programa SPARK, donde ofrecemos a estudiantes de todo el mundo la oportunidad de llevar sus proyectos de innovacién al espacio en los primeros lanzamientos de nuestro cohete MIURA 5.  Si tu clase tiene una propuesta creativa para resolver los retos de la Tierra desde el espacio, podéis inscribiros en nuestra web hasta el 15 de noviembre spark- program.pldspace.com  Emparejaremos tu experimento con uno de los satélites seleccionados y podras alcanzar las estrellas.  iTe esperamos!  Gracias a Ministry of Science and Innovation of Spain, Agencia Espacial Espafiola, CSIC, Generalitat Valenciana y OE - Organizacién de Estados Iberoamericanos.  “2 Our SPARK program is opening its back-to-school call for educational payloads. Younger generations at schools, high-schools and vocational training centers from all over the world will have a unique opportunity to take their creative space-based innovation projects beyond the classroom onboard of our MIURA 5 first launches. Selected projects will have the opportunity to work alongside commercial satellite platform providers.  Application process is now open until November 15th at) spark- program.pldspace.com  Good luck to everyone on our common purpose! We look forward to receiving your application!  Thanks to Ministry of Science and Innovation of Spain, Agencia Espacial Espafiola, CSIC, Generalitat Valenciana and OEI - Organizacién de Estados Iberoamericanos.    [CONTINUED_FROM_SCROLL]  Good luck to everyone on our common purpose! We look forward to receiving your application!  Thanks to Ministry of Science and Innovation of Spain, Agencia Espacial Espafiola, CSIC, Generalitat Valenciana and OEI - Organizacién de Estados Iberoamericanos.  MIURA 5 SPARK PROGRAM  Sparking space-based innovation by younger generations  PLDSPACE  Back-to-School Call for Educational Applications now open!  Apply not  wwwspark-program,pidspace.com  €C@ 152 5 comments - 22 reposts  Like © Comment Repost J Send",https://www.linkedin.com/posts/pld-space_abrimos-la-convocatoria-para-centros-de-activity-7239910471607156740-94n4?utm_source=share&utm_medium=member_desktop&rcm=ACoAAFsyZUYBH2tDEsbgneW-xiicuGyTwj5RqN8
PLD Space,"wwwspark-program,pidspace.com  CC@ 152  comments - 22 reposts  Like © Comment Repost J Send  PLD Space + Follow 60,170 followers 9mo + Edited» ©  Meet our Team at SmallSat 2024 next week!  Don't miss Cesar Bernal, Sales Manager, and Pablo Gallego Sanmiguel, VP of Sales & Customers to know more about MIURA 5 orbital launch opportunities and our SPARK program, an initiative that offers no-cost smallsat launch services in support of innovative educational, institutional and commercial payloads.  Get in touch and book a meeting with us here: https://Ic.cx/WJpDMw  See you all there!  Z  AUGUST 3-8  ‘Small Satellite  Conference ‘i ‘ ayia small EQ SATELTITE  ALDSPACE Le Sas  papi tniteg ag pot , César Bernall oN",https://www.linkedin.com/posts/pld-space_meet-our-team-at-smallsat-2024-next-week-activity-7224017722429325314-cKNj?utm_source=share&utm_medium=member_desktop&rcm=ACoAAFsyZUYBH2tDEsbgneW-xiicuGyTwj5RqN8
PLD Space,"2) We are amazed at the level of creativity and innovation in the proposals we are receiving for our SPARK programme. In collaboration with educational centres, institutions and commercial companies, we aim to have a transformative impact on Earth by offering free access to space on the first two MIURA 5 launches.  To date we have received a huge number of proposals from countries as diverse as the USA, Chile, Panama, Germany, Switzerland or the UK.  Many of you have asked us for more time to prepare and present your projects. We are therefore announcing today that we are extending the deadline for the preliminary submission of proposals until 30 September. If you want to know more about SPARK and apply, click on the programme link:  https://Inkd.in/d8jGDgAM  Thanks to all of you who are entrusting PLD Space to test your scientific and technological projects, and also to the institutions that have supported us from the start in this initiative ry of Science and Innovation of Spain, Agencia Espacial Espafiola, CSIC, Generalitat Valenciana, OEI - Organizacién de Estados Iberoamericanos and ESERO Spain.  2) Nos esté impresionando el grado de creatividad e innovacién de las propuestas que estamos recibiendo para nuestro programa SPARK. Nuestro propésito es que juntos (centros educativos, instituciones y empresas comerciales) generemos un impacto transformador en la Tierra ofreciendo acceso gratuito al espacio en los 2 primeros lanzamientos de MIURA 5.  Hasta la fecha hemos recibido un gran ntimero de propuestas de paises tan dispares como EEUU, Chile, Panama, Alemania, Suiza 0 Reino Unido.  Muchos de vosotros nos habéis pedido més tiempo para preparar y presentar vuestros proyectos, Por eso hoy anunciamos que ampliamos el plazo del envio preliminar de las propuestas hasta el 30 de septiembre. Si quieres saber mas sobre SPARK y presentar tu candidatura, haz clic en el enlace del programa E  https://Inkd.in/dCr-Tyuq  Gracias a todos los que estdis confiando en PLD Space para poner a prueba vuestros.   [CONTINUED_FROM_SCROLL]  and apply, click on the programme link: https://Inkd.in/d8jGDgAM  Thanks to all of you who are entrusting PLD Space to test your scientific and technological projects, and also to the institutions that have supported us from the start in this initiative Ministry of Science and Innovation of Spain, Agencia Espacial Espafiola, CSIC, Generalitat Valenciana, OEI - Organizacién de Estados Iberoamericanos and ESERO Spain.  > Nos esta impresionando el grado de creatividad e innovacién de las propuestas, que estamos recibiendo para nuestro programa SPARK. Nuestro propésito es que juntos (centros educativos, instituciones y empresas comerciales) generemos un impacto transformador en la Tierra ofreciendo acceso gratuito al espacio en los 2 primeros lanzamientos de MIURA 5.  Hasta la fecha hemos recibido un gran ntimero de propuestas de paises tan dispares como EEUU, Chile, Panama, Alemania, Suiza 0 Reino Unido.  Muchos de vosotros nos habéis pedido més tiempo para preparar y presentar vuestros proyectos, Por eso hoy anunciamos que ampliamos el plazo del envio preliminar de las propuestas hasta el 30 de septiembre. Si quieres saber mas sobre SPARK y presentar tu candidatura, haz clic en el enlace del programa E  https://Inkd.in/dCr-Tyuq  Gracias a todos los que estdis confiando en PLD Space para poner a prueba vuestros proyectos cientificos y tecnolégicos, también a las instituciones que nos apoydis en esta iniciativa Ministry of Science and Innovation of Spain, Agencia Espacial Espafiola, CSIC, Generalitat Valenciana, OEI - Organizacién de Estados Iberoamericanos y ESERO Spain.  MIURA 5 SPARK PROGRAM",https://www.linkedin.com/posts/pld-space_we-are-amazed-at-the-level-of-creativity-activity-7222172770757988353-hFBm?utm_source=share&utm_medium=member_desktop&rcm=ACoAAFsyZUYBH2tDEsbgneW-xiicuGyTwj5RqN8
PLD Space,"Hoy anunciamos que la banca espafiola, con Santander y EBN Banco a la cabeza, ha financiado con 31 millones de euros nuestro lanzador MIURA 5.  La operaci6n, en la que también ha participado el ICO - Instituto de Cré ‘cuenta con la cobertura de la Péliza de Inversiones Estratégicas de Cesce y el asesoramiento legal de Deloitte y Watson Farley & Williams.  Oficial,  #° Los fondos se destinarén al desarrollo del programa #MIURAS, asi como ala ampliacién de nuestras capacidades industriales y expansi6n corporativa.  Mis info aqui — https://bit.ly/3zwVEe7  #VamosMIURA  ‘Today we announce that Spanish banks Santander and EBN Banco lead €31 million financing for our MIURA 5 launcher.  The operation, which also includes participation from ICO - Instituto de Crédito Oficial, is covered under Cesce's Strategic Investments Policy and includes legal advice from Deloitte and Watson Farley & Williams.  # The funds will be allocated to our #MIURAS programme, as well as to the ‘expansion of our industrial capabilities and corporate growth.  More info here — https://bit.ly/3VUTBYW  #VamosMIURA",https://www.linkedin.com/posts/pld-space_miura5-vamosmiura-miura5-activity-7217516691432325120--WWd?utm_source=share&utm_medium=member_desktop&rcm=ACoAAFsyZUYBH2tDEsbgneW-xiicuGyTwj5RqN8
PLD Space,"ket Engineering Student Summit 2024, promoting our Internship Program Management Challenge.  The challenge, introduced by our Project Manager Gianluca Carollo brought together the best Italian university rocketry teams and was designed to test the management and leadership skills of future engineers through the evaluation of their rocket launcher projects.  Today we are glad to massively congratulate the PoliTo Rocket Team from the  Politecnico di Torino as winners of the first edition of our Internship Program! Looking forward to seeing you onboard soon!  #spacetalent  PROGRAM MANAGEMENT CHALLENGE  WINNNERS  — 2024",https://www.linkedin.com/posts/pld-space_spacetalent-activity-7216740388290629632-WDmu?utm_source=share&utm_medium=member_desktop&rcm=ACoAAFsyZUYBH2tDEsbgneW-xiicuGyTwj5RqN8
PLD Space,"#Hiring | Estamos contratando! 5”  En nuestra misién por hacer realidad el col ble lider en Europa, en PLD Space buscamos incorporar un Coating Technician, profesional especialista en idear y aplicar soluciones de recubrimiento para nuestro lanzador MIURA 5.  atraen los grandes retos tecnolégicos y solucionar en equipo problemas nu vistos, descubre aqu/ los detalles de la posicién:  https://tly/glidK  elanza tu carrera y Unete a un proyecto pionero en Europa!  #talento #spacetalent  Show translation  PLSSPACE  jESTAMOS CONTRATANDO! Coating Technician  Idea los acabados mas resistentes para el lanzamiento de un MIURA 5",https://www.linkedin.com/posts/pld-space_hiring-talento-spacetalent-activity-7216022170420838400-tJd2?utm_source=share&utm_medium=member_desktop&rcm=ACoAAFsyZUYBH2tDEsbgneW-xiicuGyTwj5RqN8
PLD Space,"PLD Space Tr FONOW 60,170 followers 10mo- ©  Nuestro presidente ejecutivo, Ezequiel Sanchez, tuvo ayer el placer de dar la ponencia principal del Reencuentro 15x15 de EDEM Escuela de Empresarios, una jorada de ""Vuelta a las aulas’ que reunié a los participantes de todas las ediciones de su prestigioso programa de liderazgo 15x15.  Ezequiel animé al publico a huir del statu quo y mirar siempre hacia el futuro. “Lideramos la industria espacial europea de nuevos lanzadores gracias a un enfoque estratégico de corto y largo plazo"", sefialé en su charla magistral.  Muy agradecidos a EDEM Escuela de Empresarios por la invitacién y, en especial, a Hortensia Roig por su amabilidad. jEsperamos volver pronto!  Show translation  C@ 153 4 reposts  ® Like © Comment 1% Repost 7 Send",https://www.linkedin.com/posts/pld-space_nuestro-presidente-ejecutivo-ezequiel-s%C3%A1nchez-activity-7214890948365869057-wOqe?utm_source=share&utm_medium=member_desktop&rcm=ACoAAFsyZUYBH2tDEsbgneW-xiicuGyTwj5RqN8
