company,postContent,postUrl
PLD Space,"The first edition of SmallSat Europe in Amsterdam is around the corner!  ‘Feel invited to attend the panel discussion ‘Availability of Current and Planned Launch Capabilities’ where Pablo Gallego Sanmiguel, Senior Vice President of Sales & Customers, will elaborate on how we are building the MIURA 5 launch system at speed and scale while adapting to increasing on-demand customer requirements based on flexibility and responsiveness,  If you also would like to meet us in person to discuss potential partnerships or future launch opportunities, feel free to book your one2one meeting with Pablo below:  https://bit.ly/3Fqn9t4  See you all there!  >PLDSPAC May 27, 2025  Panel Discussion Availability of Current and Planned Launch @PSMALLSAT  Capabilities bem. EUROPE  @ 130 - 2.30 pm (cesT) @) Pablo Gallego pa, Soman  Pof Sales & Customers  CO 69 3 comments - 6 reposts  Like © Comment Repost J Send  PLD Space + Follow  60,168",https://www.linkedin.com/posts/pld-space_the-first-edition-of-smallsat-europe-in-amsterdam-activity-7330550051791962112-jm-Q?utm_source=share&utm_medium=member_desktop&rcm=ACoAAFsyZUYBH2tDEsbgneW-xiicuGyTwj5RqN8
PLD Space,"MIURA 5 is hirin|  ‘At PLD Space, every challenge we face is an opportunity to grow and to make a difference.  Our team shares a common goal: to unlock access to space in a way that's fast, sustainable, and meaningful.  From global collaboration to pushing the limits of technology, this is where curiosity meets purpose  Ready to join us? We're hiring for key roles across our team:  CNC Machinist: https://bit.ly/492teq5  Metallic Coating Engineer (EDP): https://bit.ly/436td2W [Propulsion Test Engineer: https://bit.ly/4kcJIAD Manufacturing Engineer: https://bit.ly/4cYGDBB Additive Manufacturing Engineer: https://bit.ly/3HbIFDM CAD/CAM Programmer: https://bit.ly/4ms4NbP  OC 237 2 comments - 25 reposts",https://www.linkedin.com/posts/pld-space_%F0%9D%97%A0%F0%9D%97%9C%F0%9D%97%A8%F0%9D%97%A5%F0%9D%97%94-%F0%9D%9F%B1-%F0%9D%97%B6%F0%9D%98%80-%F0%9D%97%B5%F0%9D%97%B6%F0%9D%97%BF%F0%9D%97%B6%F0%9D%97%BB%F0%9D%97%B4-at-pld-activity-7333093488604934144-Zw_a?utm_source=share&utm_medium=member_desktop&rcm=ACoAAFsyZUYBH2tDEsbgneW-xiicuGyTwj5RqN8
PLD Space,">PLDSPACE  © Comment    [CONTINUED_FROM_SCROLL]  Ed «..c 6d-® CAD/CAM Programmer Wanted!  At PLD Space, you'll be part of a small, agile team working closely with machinists, engineers, and production leads to ensure the correct fabrication of MIURA 5  components through every step of the manufacturing process.  We're looking for professionals who value control and precision as essential tools to manufacture cutting-edge components for the aerospace industry.  Start your application here!  https://bit.ly/4ms4NbP",https://www.linkedin.com/posts/pld-space_%F0%9D%97%96%F0%9D%97%94%F0%9D%97%97%F0%9D%97%96%F0%9D%97%94%F0%9D%97%A0-%F0%9D%97%A3%F0%9D%97%BF%F0%9D%97%BC%F0%9D%97%B4%F0%9D%97%BF%F0%9D%97%AE%F0%9D%97%BA%F0%9D%97%BA%F0%9D%97%B2%F0%9D%97%BF-%F0%9D%97%AA%F0%9D%97%AE%F0%9D%97%BB-activity-7331236145265033228-Jb4D?utm_source=share&utm_medium=member_desktop&rcm=ACoAAFsyZUYBH2tDEsbgneW-xiicuGyTwj5RqN8
PLD Space,MIURA 5 esté contratando!  Unete a un equipo de primer nivel que hoy busca dar solucién a los desafios de fabricacién més exigentes para construir el mafiana del transporte espacial.  Consulta nuestras oportunidades més destacadas aqui:  Operario de mecanizado CNC: Metallic Coating Engineer (EDP): Propulsion Tooling Engineer: Manufacturing Engineer:  Additive Manufacturing Engineer:  iTu futuro empieza aqui! :Lo construimos juntos?  Show translation  -  iMIURA 5 esta,https://www.linkedin.com/posts/pld-space_miura-5-est%C3%A1-contratando-activity-7323299007403835392-Fe9f?utm_source=share&utm_medium=member_desktop&rcm=ACoAAFsyZUYBH2tDEsbgneW-xiicuGyTwj5RqN8
PLD Space,"At PLD Space, our CNC Machinists turn raw materials into precision ...more  mments  © Comment 4 Send  + Follow    [CONTINUED_FROM_SCROLL]  ‘At PLD Space, our CNC Machinists turn raw materials into precision components that power the next generation of European spaceflight.  We're looking for detail-driven professionals who thrive in fast-paced teams and take pride in building space technology—one micron at a time.  Start your application here!",https://www.linkedin.com/posts/pld-space_%F0%9D%97%96%F0%9D%97%A1%F0%9D%97%96-%F0%9D%97%A0%F0%9D%97%AE%F0%9D%97%B0%F0%9D%97%B5%F0%9D%97%B6%F0%9D%97%BB%F0%9D%97%B6%F0%9D%98%80%F0%9D%98%81-%F0%9D%97%AA%F0%9D%97%AE%F0%9D%97%BB%F0%9D%98%81%F0%9D%97%B2%F0%9D%97%B1-activity-7329060738763767808-qlma?utm_source=share&utm_medium=member_desktop&rcm=ACoAAFsyZUYBH2tDEsbgneW-xiicuGyTwj5RqN8
PLD Space,"PLD Space + Follow 60,168 followers ®  Join us next week at FEINDEF (Feria Internacional de Defensa y Seguridad de Espafia), Spain's International Defence and Security Exhibition, backed by the institutional support of the Ministry of Defence.  Visit us at booth 10A30 to explore new partnerships, engage with our experts, and discuss how we can help drive your future flight missions forward.  We look forward to welcoming you!  >PLDSPAC e FEINDEF 25  Booth 10A30 March 12 IFEMA  1 comment - 3 reposts Like © Comment Repost J Send PLD Space + Follow  60,168  ()  Propulsion Tooling Engineers Wanted!  PLD Space Propulsion Tooling Engineers are responsible for the design, fabrication, integration, test, and delivery of production tooling and fixturing solutions to our",https://www.linkedin.com/posts/pld-space_join-us-next-week-at-feindef-feria-internacional-activity-7326555749730422784-F5xr?utm_source=share&utm_medium=member_desktop&rcm=ACoAAFsyZUYBH2tDEsbgneW-xiicuGyTwj5RqN8
PLD Space,"Propulsion Tooling Engineers Wanted!  PLD Space Propulsion Tooling Engineers are responsible for the design, fabrication, integration, test, and delivery of production tooling and fixturing solutions to our TEPREL-C engine production.  ly turn ideas and concepts into fully functioning components ready to support production and testing of  MIURA 5 rocket engine:  Start your application here:  https://bit.ly/3SjI7N3  JOIN Pl SPAC GLOBAL ENGINEERING TEAM",https://www.linkedin.com/posts/pld-space_%F0%9D%97%A3%F0%9D%97%BF%F0%9D%97%BC%F0%9D%97%BD%F0%9D%98%82%F0%9D%97%B9%F0%9D%98%80%F0%9D%97%B6%F0%9D%97%BC%F0%9D%97%BB-%F0%9D%97%A7%F0%9D%97%BC%F0%9D%97%BC%F0%9D%97%B9%F0%9D%97%B6%F0%9D%97%BB%F0%9D%97%B4-%F0%9D%97%98%F0%9D%97%BB%F0%9D%97%B4%F0%9D%97%B6%F0%9D%97%BB%F0%9D%97%B2%F0%9D%97%B2%F0%9D%97%BF%F0%9D%98%80-activity-7328372566740385793-8TXa?utm_source=share&utm_medium=member_desktop&rcm=ACoAAFsyZUYBH2tDEsbgneW-xiicuGyTwj5RqN8
PLD Space,"afio lo hace con PLD Space como principal impulsor ©»  PLD Space colidera el campamento espacial mas avanzado de Espafia -con 5  Show translation  SPACE CAMP VALENCIA EXPLORA EL UNIVERSO CON SPACE CAMP  Tu primer paso en la  carrera espacial  Entrenamiento REAL para jOvenes astronautas  PLDSPACE  Impulsor Tecnologico  © Comment 7 Send   [CONTINUED_FROM_SCROLL]  we ® \Vuelve Space Camp y este afio lo hace con PLD Space como principal impulsor ©” PLD Space colidera el campamento espacial mas avanzado de Espafia -con 5  expediciones semanales entre el 23 de junio y el 25 de julio de 2025 en Valencia- para inspirar a nifios de entre 10 y 17 aftos.  En este Space Camp, organizado por , participamos activamente a través de becas, mentorizacién, visitas didécticas a la fébrica de MIURA 5 y con la cocreacién de 3 talleres précticos:  + Hackathon ""Salvar el huevo"": simulaci6n de un aterrizaje en Marte que incluye un tour por nuestra sede central.  + Construye y lanza un cohete: disefio y lanzamiento de un cohete de agua inspirado en MIURA 5.  + Mars Mission: aventura de realidad virtual con LINCE y MIURA Next.  S Inscripcién abierta aqué  Show translation  CAMP  @s See  EXPLORA EL UNIVERSO CON SPACE CAMP  Tu primer paso en la  carrera espacial  Entrenamiento REAL para jOvenes astronautas",https://www.linkedin.com/posts/pld-space_vuelve-space-camp-y-este-a%C3%B1o-lo-hace-con-activity-7325451618995331072-j8ph?utm_source=share&utm_medium=member_desktop&rcm=ACoAAFsyZUYBH2tDEsbgneW-xiicuGyTwj5RqN8
PLD Space,"PLDSPAC  Impulgor Teend  CO 155 7 comments - 13 reposts Like © Comment Repost J Send  PLD Space  60,168 followers  imo+® ¥ Itisa great honor for us that the case 'PLD Space’ has won the 2025 Case Writing Competition in the ‘Bringing Technology to Market' category (organized in partnership with ). Professors and , together with our Executive President, have done a remarkable job turning our business model  into a case study for executive leadership programs.  Thank you to IESE Business School for inviting us to participate live in their class discussions, such as the one yesterday as part of their PDG, where our CBDO and Co- founder, , had the chance to share his firsthand experience and answer the students’ questions.  \& Ifyou're interested in the case, it is available here:  Case: >PLDSPACE  > Alejandro Serrano  > Pip  > Ezequiel Sane",https://www.linkedin.com/posts/pld-space_spaceindustry-casemethod-innovation-activity-7321470035040829441-X5_q?utm_source=share&utm_medium=member_desktop&rcm=ACoAAFsyZUYBH2tDEsbgneW-xiicuGyTwj5RqN8
PLD Space,"Ee im ®D  4 Yesterday we completed the recruitment process of our first Early Talent Program!  Out of more than 800 applicants registered for our first summer internship program, 55 students from 17 national and international universities have been pre-selected to participate in the MIURA 5, MIURA Next, and Business areas.  This group of young talents had the opportunity to visit our headquarters in person, attend an inspiring talk by our CEO, Ratil Torres, and put their technical skills, problem- solving abilities, and teamwork to the test through various hands-on challenges coordinated by our area managers  A special thanks to all the universities that partnered with us. We can't wait for the selected candidates to join our team!  Next AdAstra Early Talent Day r October 16, 2025. https://Inkd.in/dzzdHeaT  4 Ayer completamos el proceso de seleccién de la primera edicién de nuestro Early Talent Program!  De entre los mas de 800 candidatos registrados en nuestro primer programa de practicas de verano, 55 estudiantes de 17 universidades nacionales e internacionales han sido preseleccionados para participar en las éreas de MIURA 5, Next y Business.  Este grupo de jévenes ha tenido la oportunidad de conocer en persona nuestra sede central, recibir una charla inspiradora de nuestro CEO, Ratil Torres, y poner a prueba sus habilidades técnicas, de resolucién de problemas y de trabajo en equipo en  diferentes desafios practicos, coordinados por nuestros responsables de area.  Un agradecimiento especial para todas las universidades colaboradoras, jestamos deseando que los seleccionados se incorporen nuestro equipo!  Proxima edicién AdAstra Early Talent Day dr 16 octubre de 2025.  https://Inkd.in/dzzdHe4T",https://www.linkedin.com/posts/pld-space_yesterday-we-completed-the-recruitment-activity-7321137596825239552-Uapm?utm_source=share&utm_medium=member_desktop&rcm=ACoAAFsyZUYBH2tDEsbgneW-xiicuGyTwj5RqN8
PLD Space,"PLD Space + Follow 60,168 followers 2mo+@  jUltima llamada, estudiantes y graduados!  PLD Space Academy presenta AdAstra Early Talent Day, un evento en formato ...more  Show translation  >AdAstra  ARLY TALENT DAY  Tu futuro empieza aqui.  programa de practicas de  View event  AdAstra Early Talent Day  GO 103 14 reposts  Like © Comment Repost J Send  + Follow  © Un honor recibir hoy en casa al astronauta espafiol Pablo Alvarez Fernandez. Nos  po  a   [CONTINUED_FROM_SCROLL]  jUltima llamada, estudiantes y graduados!  PLD Space Academy presenta AdAstra Early Talent Day, un evento en formato live streaming transmitido desde nuestro Control de Misién que te permitiré  + Conocer los beneficios y caract Impacto.  + Saber més sobre nuestra cultura, visién y retos tecnolégicos.  + Descubrir roles y oportunidades de desarrollo profesional en ingenierfa, fabricacién y business.  jicas de nuestro Programa de Practicas de Alto  El evento tendré lugar el préximo 25 de marzo a las 17h00 y sera moderado por el divulgador y cientifico Javier Santaolalla Camino.  Contaremos ademés con la participacién de nuestro CEO, Ratil Torres, y parte del equipo de talento, ingenieria y negocio, que esté llevando a cabo los proyectos mas vanguardistas dentro de PLD Space.  iTu futuro empieza aqui!  Show translation  >AdAstra  ALY TALENT DAY  Tu futuro empieza aqui.",https://www.linkedin.com/posts/pld-space_%C3%BAltima-llamada-estudiantes-y-graduados-activity-7308438326825439232-6G8S?utm_source=share&utm_medium=member_desktop&rcm=ACoAAFsyZUYBH2tDEsbgneW-xiicuGyTwj5RqN8
PLD Space,"© Un honor recibir hoy en casa al astronauta espafiol Pablo Alvarez Fernandez. Nos hace mucha ilusién que la primera cdpsula espacial en la que se ha sentado antes de viajar al espacio sea en nuestra LINCE.  Sus palabras de carifio y 4nimo han resultado inspiradoras para todo nuestro equipo y le deseamos un futuro lleno de éxitos.  Pablo no ha venido solo, le han acompajiado a nuestras instalaciones, la ministra de ry of Science and Innovation of Spain, Diana Morant Ripoll el director de la Agencia Espacial Espafiola, Juan Carlos Cortés; y la directora de Ciencia de  la European Space Agency - ESA, Professor Carole Mundell, poniendo en valor que garantizar el acceso al espacio de Espafia y Europa es una misién de todos,  Toda la info de la vista aqui @r https://bit.ly/3FSIFI3  Show translation",https://www.linkedin.com/posts/pld-space_un-honor-recibir-hoy-en-casa-al-astronauta-activity-7306358547888377856-nLNt?utm_source=share&utm_medium=member_desktop&rcm=ACoAAFsyZUYBH2tDEsbgneW-xiicuGyTwj5RqN8
PLD Space,"Esta semana hemos recibido una visita del Ministry of Economy, Trade and Business. Nuestro equipo directivo ha presentado la propuesta de valor y la hoja de ruta de PLD Space a una delegacién de la Direccién General de Comercio Internacional e  Inversiones, encabezada por Alicia Varela Donoso.  Encantados de recibirles en nuestra sede central y del interés mostrado en conocer de primera mano el proceso de disefio, desarrollo y fabricacién de MIURA 5. Estamos muy agradecidos por todo el esfuerzo que realizan para las empresas espajiolas.  Show translation  €€O 360 2 comments - 15 reposts",https://www.linkedin.com/posts/pld-space_esta-semana-hemos-recibido-una-visita-del-activity-7306257053516206082-fomk?utm_source=share&utm_medium=member_desktop&rcm=ACoAAFsyZUYBH2tDEsbgneW-xiicuGyTwj5RqN8
PLD Space,"On International Women's Day, we celebrate the leadership of the women driving our company forward. Their talent, effort, and passion are key to our mission of providing complete and sustainable access to space, breaking the barriers of technology.  Together, we keep shaping the future!  En el Dia Internacional de la Mujer, celebramos el liderazgo de las mujeres que forman parte de PLD Space. Su talento, esfuerzo y pasién son clave en nuestra misién de ofrecer un acceso completo y sostenible al espacio, rompiendo las barreras dela tecnologia  iSeguimos transformando el futuro de la mano!  #InternationalWomensDay #DialnternacionalDeLaMujer  gikile 5 is ME Oop ge VEO  6 comments - 25 reposts",https://www.linkedin.com/posts/pld-space_internationalwomensday-diainternacionaldelamujer-activity-7304048271113490433-kQ_S?utm_source=share&utm_medium=member_desktop&rcm=ACoAAFsyZUYBH2tDEsbgneW-xiicuGyTwj5RqN8
PLD Space,"This is how we build MIURA 5 5°  At our state-of-the-art facility, we manufacture all metallic structures of our launch vehicle and its TEPREL-C family engines (including combustion chambers and ‘turbopumps). Where we combine proven industry technologies with years of heritage and cutting-edge processes like metal additive manufacturing and laser welding.  Robust end-to-end process management, with quality control integrated into each step, ensures that all engineering models reach our test benches in Teruel exactly as designed. There, we test and use the results to rapidly iterate and improve manufacturing until every subsystem is qualified.  This approach gives us the agility and flexibility to move confidently toward the first MIURA 5 test flight at CSG (CNES/ESA) in Kourou, French Guiana, delivering on our promise of reliability and performance.  €€@O 1,308 27 comments - 80 reposts  ® Like © Comment 1% Repost 7 Send  PLD Space + Follow",https://www.linkedin.com/posts/pld-space_this-is-how-we-build-miura-5-at-our-activity-7318164973275246592-5oR2?utm_source=share&utm_medium=member_desktop&rcm=ACoAAFsyZUYBH2tDEsbgneW-xiicuGyTwj5RqN8
PLD Space,"SPARK Program Update!  Last week we celebr ion with the aim of  MIURA 5 SPARK Matchmaking Session - 7 pages  PLDSPACE  MIURA 5 SPARK PROGRAM  ®Lpsenc®  Progress Update  €€O 195  Like Repost  © Comment  4 Send   [CONTINUED_FROM_SCROLL]  Last week we cel jon with the aim of facilitating partnering and cooperation between schools, research centers, commercial enti  and key partners  In total we hosted 31 global teams showcasing their competences and find potential partners and opportunities for joint project developments.  A special thank you goes out to all the guests who attended the event! Thank you for your active participation and enthusiasm!  #space #innovation #MIURAS  PLDSPACE  MIURA 5 SPARK PROGRAM  ®Lpsenc®  Progress Update    [CONTINUED_FROM_SCROLL]  e  > Last week PL celebrated S Matchmakini the aim of fa partnering é between cus and key parti   [CONTINUED_FROM_SCROLL]  > During the hosted 11 Support ¢ Project St around the   [CONTINUED_FROM_SCROLL]  { Do  VVEITEe VECO HileU te  following challengs  Providing connectiv areas, enabling emer response and enviro! monitoring.  Educating future er satellite design and c   [CONTINUED_FROM_SCROLL]  JF @ Prevent  extends operatio tracking  Developi  technol the effec on hume   [CONTINUED_FROM_SCROLL]  Up Next: Glo! Ticket Winners. by mid Apri  Wwww.spark-program.   [CONTINUED_FROM_SCROLL]  A special congratul SPARK members, pa supporting inst",https://www.linkedin.com/posts/pld-space_miura-5-spark-matchmaking-session-activity-7297552979623084033-Yew4?utm_source=share&utm_medium=member_desktop&rcm=ACoAAFsyZUYBH2tDEsbgneW-xiicuGyTwj5RqN8
PLD Space,"SEV 195 2 comments - 2 reposts  ® Like © Comment 1% Repost 7 Send  PLD Space DM 60.168 followers 3mo+@ © © Ourrunning shoes are on fire!  Last Sunday, the PLD Space running team kicked off the season with the 29th International Half Marathon and the 10K Aguas de Alicante, participating in both the  410K and the 21K.  We congratulate all PLD Space runners for burning sole while representing key values  such as teamwork, effort and commitment,  5 comments 1 repost  ® Like © Comment 1% Repost 7 Send  PLD Space 60,168,",https://www.linkedin.com/posts/pld-space_perasperaadastra-runningonvalues-activity-7297206855200612353-Wm5f?utm_source=share&utm_medium=member_desktop&rcm=ACoAAFsyZUYBH2tDEsbgneW-xiicuGyTwj5RqN8
PLD Space,"5 comments 1 repost  ® Like © Comment 1% Repost 7 Send  PLD Space + Follow  €€0 623 6 comments - 12 reposts ® Like © Comment & Repost 7 Send PLD Space + Follow 60,168 fo  a",https://www.linkedin.com/posts/pld-space_miura-5-second-stage-fuel-tank-ready-to-freeze-activity-7292479829721931776-gxcN?utm_source=share&utm_medium=member_desktop&rcm=ACoAAFsyZUYBH2tDEsbgneW-xiicuGyTwj5RqN8
PLD Space,"2mo+ @  © Sino pudiste conectarte al evento de presentacién de nuestro Programa de Practicas, puedes verlo completo aqui  Moderado por el cientifico y divulgador yconla participacién de nuestro CEO, , asi como diferentes miembros del equipo  de PLD Space, descubriras:  = Los beneficios y caracteristicas de nuestro Programa de Practicas de Alto Impacto para este verano 2025  = Nuestra cultura, vision y retos tecnolégicos = Las oportunidades de desarrollo profesional en ingenierfa, fabricacién y business.  + {No lo dudes! Tienes hasta el 1 de abril para presentar tu candidatura a nuestro Programa de Practicas aqui  iTu futuro empieza aqui! s°  Show translation",https://www.linkedin.com/posts/pld-space_si-no-pudiste-conectarte-al-evento-de-activity-7310968267282513921-dGR-?utm_source=share&utm_medium=member_desktop&rcm=ACoAAFsyZUYBH2tDEsbgneW-xiicuGyTwj5RqN8
PLD Space,PLD Space  68  iUnete al Equipo de PLD Space!  Buscamos incorporar ingenieros civiles expertos en instalaciones y estructuras para  seguir construyendo el presente y futuro de nuestra factoria de lanzadores espaciales e instalaciones de ensayos:  >Ingeniero de Obra Civil (Instalaciones)  > Ingeniero de Obra Civil (Estructuras)  iUnete a un equipo de ingenieros multidisciplinar que ambiciona construir las  infraestructuras privadas de desarrollo de tecnologias aeroespaciales mas avanzadas de Europa!  Show translation  PLOSPACE PLDSPACE  INGENIERO/A INGENIERO/A OBRA CIVIL DE O8RA CIVIL  STRUCTUR? TALACIONES)  C20 4  10 reposts  ® Like © Comment & Repost 7 Send,https://www.linkedin.com/posts/pld-space_%C3%BAnete-al-equipo-de-pld-space-buscamos-activity-7288159728545779713-ae-x?utm_source=share&utm_medium=member_desktop&rcm=ACoAAFsyZUYBH2tDEsbgneW-xiicuGyTwj5RqN8
PLD Space,"Oo  EE # PLD Space operates cutting-edge facilities for design, production, testing, and launch to ensure the availability of our rockets on time, on cost, and with the highest quality.  4mo  At our state-of-the-art 12,500 m? PLD Space headquarters in Elche (Alicante), we bring to life both current and future innovations. Fully aligned with our vertical integration model, engineering and manufacturing collaborate seamlessly under one roof, driving rapid iteration and ensuring the highest standards of quality control in the development of our cutting-edge launch vehicles.  Boasting the capacity to produce 6 MIURA 5 rockets and 60 TEPREL-C engines annually, our factory blends cutting-edge technologies with the most trusted industry techniques, offering a comprehensive production process that ensures the highest levels of scalability and reliability.  Our main facility, with capacity for 400+ employees, is designed to inspire innovation and seamless communication through open, collaborative spaces.  With the combined efforts of our industrial partners, we've established this world-class infrastructure, setting new benchmarks of excellence.",https://www.linkedin.com/posts/pld-space_pld-space-operates-cutting-edge-facilities-activity-7285596340724649984-bNtk?utm_source=share&utm_medium=member_desktop&rcm=ACoAAFsyZUYBH2tDEsbgneW-xiicuGyTwj5RqN8
PLD Space,"| > | 60,168 followers 4mo+ ©  En PLD Space nos sentimos orgullos de contribuir a generar ‘Marca Espajia’ dentro y fuera de nuestras fronteras en una industria global y estratégica como la del espacio.  Desde 2011, llevamos la ‘Marca Espafia’ por todo el mundo y seguiremos haciéndolo con nuestros servicios de transporte espacial, dotando a Espafia de la capacidad estratégica de acceso al espacio sf”  ‘Agradecemos a The Leading Brands of Spain Forum el guifio en la portada de ‘ES+, el Anuario de la Marca Espafia' y la entrevista a nuestro cofundador y CBDO, Ratil Verdu, en sus paginas interiores.  Aqui puedes ver la entrevista completa E https://bitly/40sE8D0  Show translation  CO 204 5 comments - 6 reposts  ® Like © Comment 1% Repost 7 Send  PLD Space + Follow",https://www.linkedin.com/posts/pld-space_en-pld-space-nos-sentimos-orgullos-de-contribuir-activity-7284533557232889856-gUNP?utm_source=share&utm_medium=member_desktop&rcm=ACoAAFsyZUYBH2tDEsbgneW-xiicuGyTwj5RqN8
PLD Space,"‘The PLD Space team wishes you Happy Holidays. These Holidays celebrate the magic of togetherness!  El equipo de PLD Space os desea Felices Fiestas. jEsta Navidad celebra la magia de la unién!  eC@ 501 10 comments - 26 reposts  ® Like © Comment 1% Repost 7 Send  PLD Space + Follow 60,169 ®  iAmpliamos el equipo técnico de los bancos de ensayos de MIURA 5!",https://www.linkedin.com/posts/pld-space_the-pld-space-team-wishes-you-happy-holidays-activity-7275907290916864000-su_1?utm_source=share&utm_medium=member_desktop&rcm=ACoAAFsyZUYBH2tDEsbgneW-xiicuGyTwj5RqN8
