company,postContent,postUrl
Sirius Space Services,"€@O 225 14 comments - 14 reposts  ® Like © Comment 1% Repost J Send Sirius Space Services + Follow FEA 12361 followers 5mo+@  [Exposition] - 3, 2, 1, top... Décollage ! #”  Du 7 décembre 2024 au 9 février 2025, le Chateau de Ladoucette 4 Drancy ... more  Show translation  3, 2, 1, top. Dédbllag@!  €@52 1 repost  Like © Comment Repost J Send  Sirius Space Services + Follow EE. 12,361 followers: 3mo+@  2 Gearing up, Spinning up, and Pushing furthe    [CONTINUED_FROM_SCROLL]  smo» @  [Exposition] - 3, 2, 1, top... Décollage !  Du 7 décembre 2024 au 9 février 2025, le Chateau de Ladoucette & Drancy vous ouvre ses portes pour une immersion unique dans histoire, I'évolution et les nouvelles perspectives des lanceurs spatiaux.  Cette exposition retrace 'épopée fascinante des lanceurs, depuis les pionniers d’avant- guerre jusqu’a la récente révolution du New Space.  Découvrez pourquoi l'accés 8 I'espace est essentiel pour répondre aux enjeux stratégiques, scientifiques et commerciaux du monde actuel ! Et comment Si Services, innove pour répondre a une partie de ces défis grace a sa gamme de lanceurs.  Space  C’est aussi l'occasion idéale de découvrir notre chambre de combustion STAR-1, 100 % congue en interne grace @ la fabrication additive métallique. >  © Dates : 7 décembre 2024 - 9 février 2024 © Lieu : Chateau de Ladoucette - Drancy © Horaires : Entrée libre du mardi au samedi, de 12h 4 17h  Passionné d’espace ou curieux ? Venez explorer histoire des lanceurs et comprendre les enjeux de demain.  Pierre-Frangois MOURIAUX | Mairie de Drancy | Air & Cosmos | Centre National d'Etudes  Spatiales | #Exposition | #SiriusSpaceServices | #NewSpace | #ExplorationSpatiale | #innovation |  Show translation",https://www.linkedin.com/posts/sirius-space-services_exposition-siriusspaceservices-newspace-activity-7270481307699146752-ryQg?utm_source=share&utm_medium=member_desktop&rcm=ACoAAFsyZUYBH2tDEsbgneW-xiicuGyTwj5RqN8
Sirius Space Services,"am ~'""lus Space Services 7 Follow fee 12301 Qwers c 3mo+®  Gearing up. Spinning up, and Pushing further! ©  On January 17, part of the Sirius Space Services team hit a key milestone in our #SpaceJourney.  At the German Aerospace Center (DLR) test bench in Lampoldshausen, our in- house #Turbopump successfully completed its first #testcampaign.  In just 12 seconds, it ramped up to 45,000 rpm, proving its ability to deliver high- pressure liquid methane (LNG) under real flight conditions—including bearings and the same sealing system as in our engine.  {| Fun fact - The red glow in the video comes from gaseous hydrogen burning to power the turbines. However, in the final version of our engine, we will use methane from the regenerative circuit of our expander cycle.  GB Next steps - We are finalizing the analysis of test data and moving fast toward the LOx turbopump, one of the most critical components of the engine.  This crucial milestone is paving the way for full-scale STAR-1 #FullEngine tests, as every test brings us closer to orbit!  A big shout-out to our Turbopump Department team for their hard work and dedication, and a special thanks to our partner, German Aerospace Center (DLR), for their invaluable collaboration in making this test campaign a success!  Together, let's reach the orbit! sf",https://www.linkedin.com/posts/sirius-space-services_spacejourney-turbopump-testcampaign-activity-7295120670122778624-Y_Vz?utm_source=share&utm_medium=member_desktop&rcm=ACoAAFsyZUYBH2tDEsbgneW-xiicuGyTwj5RqN8
Sirius Space Services,"topacers.  We're beyond excited to share that our #LinkedIn community has reached more than 10,000 followers! i  ‘A massive THANK YOU to each and every one of you for your support, engat and trust in our #SpaceJourney. Your enthusiasm fuels our mission every day!  And guess what? We're just getting started!  Get ready for more milestones, more testing and more behind th our #SiriusJourney— s""  Together, let's shape the future of #EuropeanSpace and reach n  iusSpace #NewSpace  10 000  #Snacarec",https://www.linkedin.com/posts/sirius-space-services_spacers-linkedin-spacejourney-activity-7292444311030321152-_d_5?utm_source=share&utm_medium=member_desktop&rcm=ACoAAFsyZUYBH2tDEsbgneW-xiicuGyTwj5RqN8
Sirius Space Services,"1 comment - 1 repost  © Comment 1% Repost J Send BY Sirius space Services + Follow FEA 12361 followers 6mo+ @  [Visite] 1° — La Région Ile de France, berceau des activités de Sirius Space Services  La semaine demiére, nous avons eu le plaisir d’accueillir Alexandra Dublanche, Vice- Présidente de la Région ile-de-France, accompagnée d’élus et d'acteurs locaux. au cceur des activités de Sirius Space Services.  MM) Depuis nos débuts, le soutien de la Région Ile de France a permis de concrétiser notre implantation prés de la capitale et de renforcer la croissance de nos effectifs et de nos péles de compétences.  @ A travers nos différents sites - Bureaux | Site de R&D | Usine pilote - nous avons présenté quatre années d’avancées significatives, ott plus de 80 collaborateurs passionnés, travaillent chaque jour sur le développement de notre gamme de petits lanceurs réutilisables : #SIRIUS.  © Ce fut un moment d’échanges privilégiés autour des enjeux stratégiques du secteur spatial francais, et notamment de notre engagement a renforcer la souveraineté nationale et la compétitivité de l'industrie spatiale en France et en Europe.  & Prochaines étapes : Alors que nous avancons vers le vol balistique de SIRIUS 1 prévu pour 2026, 'année 2025 marquera une étape décisive, placée sous le signe de Vindustrialisation.  Diici 2026, notre usine en Ile-de-France viendra renforcer notre engagement envers économie locale, avec la création d'emplois qualifiés dans l'industrie.  A. Merci encore a la Région Ile de France ainsi qu’a Alexandra Dublanche, Amaél Pilven, Directeur Général Adjoint en charge du Péle Entreprise et Emploi, Benoit Feyti Précident de la CCI 92. et Sandra LIERMANN-_MONZANI élie dis Conseil r€qianal nour    [CONTINUED_FROM_SCROLL]  [Visite] 2” — La Région Ile de France, berceau des activités de Sirius Space Services La semaine demiére, nous avons eu le plaisir d’accueillir Alexandra Dublanche, Vice- Présidente de la Région ile-de-France, accompagnée d’élus et d'acteurs locaux. au cceur des activités de Sirius Space Services.  Depuis nos débuts, le soutien de la Région Ile de France a permis de concrétiser notre implantation prés de la capitale et de renforcer la croissance de nos effectifs et de nos péles de compétences.  @ A travers nos différents sites - Bureaux | Site de R&D | Usine pilote - nous avons présenté quatre années d’avancées significatives, ott plus de 80 collaborateurs passionnés, travaillent chaque jour sur le développement de notre gamme de petits lanceurs réutilisables : #SIRIUS.  © Ce fut un moment d’échanges privilégiés autour des enjeux stratégiques du secteur spatial francais, et notamment de notre engagement a renforcer la souveraineté nationale et la compétitivité de l'industrie spatiale en France et en Europe.  Prochaines étapes : Alors que nous avancons vers le vol balistique de SIRIUS 1 prévu pour 2026, 'année 2025 marquera une étape décisive, placée sous le signe de Vindustrialisation.  Diici 2026, notre usine en Ile-de-France viendra renforcer notre engagement envers économie locale, avec la création d'emplois qualifiés dans l'industrie.  A. Merci encore a la Région Ile de France ainsi qu’a Alexandra Dublanche, Amaél Pilven, Directeur Général Adjoint en charge du Péle Entreprise et Emploi, Benoit Feyti Président de la CCI 92, et Sandra LIEBMANN-MONZANI, élue du Conseil régional pour votre visite et votre engagement 3 nos cétés pour batir un avenir spatial compétitif et durable avec Sirius !  jusJourney | #LaunchSolutions | #SmallSats | #NewSpace | #Indust  Show translation  , a P",https://www.linkedin.com/posts/sirius-space-services_sirius-siriusjourney-launchsolutions-activity-7259595374988812288-1Tz5?utm_source=share&utm_medium=member_desktop&rcm=ACoAAFsyZUYBH2tDEsbgneW-xiicuGyTwj5RqN8
Sirius Space Services,"from jeam!  munity vith inspiration, growth, and    [CONTINUED_FROM_SCROLL]  me an ® Happy New Year 2025 from Sirius Space Services Space Team!  ‘We wish our incredible community a year filled with inspiration, growth, and exciting opportunities!”  In 2025, we're thrilled to continue our extraordinary space journey with more innovation and achievements, This year is especially exciting as we move closer to the maiden flight of Sirius 1.  We're grateful to have you by our side, in every chapter of our story.  Here's to a year of shared success, bold ambitions, and reaching new heights - together!  #HappyNewYear #SiriusSpaceServices #TeamSirius #NewSpace",https://www.linkedin.com/posts/sirius-space-services_happynewyear-siriusspaceservices-teamsirius-activity-7280145765052674048-d0np?utm_source=share&utm_medium=member_desktop&rcm=ACoAAFsyZUYBH2tDEsbgneW-xiicuGyTwj5RqN8
Sirius Space Services,"[News]-' Major Space Launch Mileston  irius Space Services Partners with Equatorial Launch Austre  (ELA) for a  We're thrilled to announce an exciting new chapter for Sirius Space Services in collaboration with Equatorial Launch Australia (ELA)! This partnership is set to elevate our space launch capabilities to new heights.  @ Key Milestone: Sirius Space Services has secured a significant multi-year, multi- launch agreement with ELA to operate from the Arnhem Space Centre (ASC) in Australia. This pivotal partnership will see us become a “Resident Launcher” at ASC, marking our entry into a new phase of our space journey.  {| Why This is a Game-Changer ?  ‘* Expanded Orbital Access: Our new partnership allows us to offer a wide range of orbital inclinations, including medium and low orbits in SSO, LEO, and equatorial, enhancing our mission capabilities.  + Full-Service Excellence: Beyond launch services, we provide a comprehensive, integrated solution that includes not only the design and engineering of our rockets but also complete mission management.  * Strengthened Collaboration: This milestone highlights the robust and forward- thinking collaboration between Sirius Space Services and ELA, boosting our global operational prowess.  °% What's on the Horizon?  * Innovative Launch Infrastructure: Sirius Space Services will leverage ELA’s advanced ASCALP™ launch pad design, tailored specifically to our needs. This integration will enhance the efficiency and safety of our launches, marking a significant advancement in our operational capabilities.  * Launch Timeline: The SIRIUS campaign will kick off with the ballistic flight of Sirius 1, scheduled for 2026 in Australia, followed by the launch of the Sirius 13 launcher (800 kg payload capacity) in 2027, paving the way for high-frequency commercial orbital missions.   [CONTINUED_FROM_SCROLL]  @ Key Milestone: Sirius Space Services has secured a significant multi-year, multi- launch agreement with ELA to operate from the Arnhem Space Centre (ASC) in Australia. This pivotal partnership will see us become a “Resident Launcher” at ASC, marking our entry into a new phase of our space journey.  {| Why This is a Game-Changer ?  ‘* Expanded Orbital Access: Our new partnership allows us to offer a wide range of orbital inclinations, including medium and low orbits in SSO, LEO, and equatorial, enhancing our mission capabilities.  + Full-Service Excellence: Beyond launch services, we provide a comprehensive, integrated solution that includes not only the design and engineering of our rockets but also complete mission management.  * Strengthened Collaboration: This milestone highlights the robust and forward- thinking collaboration between Sirius Space Services and ELA, boosting our global operational prowess.  °% What's on the Horizon?  * Innovative Launch Infrastructure: Sirius Space Services will leverage ELA’s advanced ASCALP™ launch pad design, tailored specifically to our needs. This integration will enhance the efficiency and safety of our launches, marking a significant advancement in our operational capabilities.  * Launch Timeline: The SIRIUS campaign will kick off with the ballistic flight of Sirius 1, scheduled for 2026 in Australia, followed by the launch of the Sirius 13 launcher (800 kg payload capacity) in 2027, paving the way for high-frequency commercial orbital missions.  9 Stay tuned as we continue to transform the small launch market with agile, competitive, and sustainable launch solutions!  Because Your mission, Our expertise. Your orbit, Our launchers.  #SiriusSpace #ELA #Spacelndustry #LaunchServices #SpaceContract #FutureOfSpace",https://www.linkedin.com/posts/sirius-space-services_cp-sirius-space-services-x-ela-activity-7242141586518605824-Uxb4?utm_source=share&utm_medium=member_desktop&rcm=ACoAAFsyZUYBH2tDEsbgneW-xiicuGyTwj5RqN8
Sirius Space Services,"Bienvenue dans sinus Connect. ©  Notre nouvelle série de vidéos oi! nos talents prennent la parole sur des thématiques clés qui fagonnent 'avenir de l'industrie spatiale.  ii Pour inaugurer cette série, a l'occasion de la #SemaineDeLIndustrie , nous abordons un sujet qui nous tient particuligrement a coeur chez Sirius Space Services  la représentation des femmes dans le secteur spatial.  En France, elles ne représentent que 20 % des effectifs, un constat qui révéle & la fois, un défi et une réelle opportunité de transformation.  © Dans ce premier épisode, trois de nos #SpaceWomen échangent sur leurs parcours, leurs défis et leurs visions pour l'avenir du spatial  + Léa Paquentin — Ingénieure Fabrication Additive + Anaélle Gaume Larinier ~ Ingénieure Systéme + Zoé Cloix — Ingénieure Interface Mécanique  & Et vous, quelles initiatives vous inspirent pour faire évoluer l'industrie ?  si  jusConnect #FemmesDansLindustrie #Diversité #Innovation  Show translation",https://www.linkedin.com/posts/sirius-space-services_semainedelindustrie-spacewomen-siriusconnect-activity-7265718437019013121-sZlF?utm_source=share&utm_medium=member_desktop&rcm=ACoAAFsyZUYBH2tDEsbgneW-xiicuGyTwj5RqN8
Sirius Space Services,La French Fab  FAB Devine l'innovation : version présente sur notre  On a montré aux participants du salon une innovation stand afin quills devinent de quoi il s'agit @  Vous auriez deviné ? Dites-nous en commentaire !  Show translation  j  if  On a demandé aux A participants de Tech&Fest (de deviner une innovation !,https://www.linkedin.com/posts/la-french-fab_frenchfab-ugcPost-7300118828473036800-erTF?utm_source=share&utm_medium=member_desktop&rcm=ACoAAFsyZUYBH2tDEsbgneW-xiicuGyTwj5RqN8
Sirius Space Services,"+ Follow  Sirius Space Services eae:  (© 60 Seconds of Full-Thrust Power @  We're thrilled to announce the successful completion of our latest engine chamber tests conducted on October 8, 2024, at the German Aerospace Center (DLR)'s P8 test  bench in Lampoldshausen,  As part of an extended campaign that kicked off this summer, we achieved two powerful 60-second hot-fire tests using liquid methane and oxygen at cryogenic  ‘temperatures (110K & 90K).  The result? 2 minutes of continuous full-thrust operation, with no degradation, that drained the DLR's tanks to the last drop.  Key Milestones Reached: ‘* Methane-cooled engine performing at peak efficiency.  * Engine chamber 100% produced in-house using metal additive manufacturing  process.  * Setting the stage for our first full-scale engine test in Q2-2025.  ) Crank up the volume and feel STAR-1 roar! @",https://www.linkedin.com/posts/sirius-space-services_rocketengine-additivemanufacturing-fullpowerahead-activity-7252578744370917376-WOeV?utm_source=share&utm_medium=member_desktop&rcm=ACoAAFsyZUYBH2tDEsbgneW-xiicuGyTwj5RqN8
Sirius Space Services,"BY Sirius Space Services + Follow cae: 2mo+@  Advancing Propulsion: From Vision to Execution  At Sirius Space Services, we don't just imagine the future of #spaceaccess. We ...more  3 comments - 6 reposts Like © Comment Repost J Send BY Sirius Space Services + Follow FE 12361 followers 11mo + Edited - ©  [Salons] - + Quelle semaine a Viva Technology !  Comme le résume cette vidéo, I'édition 2024 de Viva Technology fut aussi ...more  Show translation   [CONTINUED_FROM_SCROLL]  PP Sirius Space Services ge 12361  Advancing Propulsion: From Vision to Execution 3° At , we don’t just imagine the future of We build it.  Since our foundation in 2020, internalizing the development and production of critical components for our has been a key objective for us.  In just a few years, we've made significant progress in both development and manufacturing, particularly with our combustion chamber:  © From partner-based production to 100% in-house manufacturing. © From 10 to 120 seconds of thrust in just 2 years.  This transition to in-house production was crucial in strengthening our capabilities. Through metal , we've gained advanced expertise that only a few players in have mastered to this day.  Guided by our principle of Build. Measure. Learn, our teams are developing and testing new iterations of our combustion chambers, solidifying our path toward the next steps.  @ Upcoming objectives: a full test in 2025 and our first ballistic flight of Sirius 1 at the end of 2026.  sf Dive back into our  Join Together, let's reach orbit!”",https://www.linkedin.com/posts/sirius-space-services_spaceaccess-siriuslaunchers-additivemanufacturing-activity-7311066686088974337-ZUJR?utm_source=share&utm_medium=member_desktop&rcm=ACoAAFsyZUYBH2tDEsbgneW-xiicuGyTwj5RqN8
Sirius Space Services,"[Salons] - naine a Viva Technology !  Commi e cette vidéo, I’édi  Show translation  ett ayy PUBLIC wapss wal  Be | wns  ‘ ¥    [CONTINUED_FROM_SCROLL]  ae eee a ines M-E*R+Col |  © Merci pour toutes ces nouvelles rencontres et notre communauté avec qui les équipes de Sirius Space Services ont pu échanger. Merci pour votre enthousiasme et votre soutien face 8 notre engagement de rendre I'accés a I'espace plus durable.  Merci a tous nos partenaires, de longues dates ou récents, qui nous accompagnent dans notre mission ; mais également au gouvernement pour son soutien et le témoignage de son intérét face aux défis de notre secteur + Valérie  Pécresse - Alexandra Dublanche - Paul Midy «  Merci aux accélérateurs #neo de Bpifrance pour avoir organisé un événement valorisant les succés des startups industrielles francaises et pour avoir invité Antoine Fourcade & partager sa vision des enjeux de l'industrie spatiale de demain sur la prestigieuse Stage One.  Merci a la La French Tech Grand Paris et ses équipes, tout particuligrement 4 Alexandra André, pour l'organisation, I'accompagnement et la bonne humeur constante ! &  Merci & OFF-WORKS, & Marine LIBOZ $ et 4 son équipe de tournage pour toutes les prises de vues réalisées avant et pendant le salon. You rock ! $8  Merci a toutes les startups avec qui nous avons partagé ces quatre jours intenses, entre Tires et célébrations ""e+ BLUE FROG ROBOTICS #® - Jalios - Tale of  Data - Voxist - Teleportin « Sorcova Health - AlchiMedics « Climeet - B in  Touch  Arbiom - OFF-WORKS « Storyfox - absolute labs - GCollect, la Fintech éthique du recouvrement MY HEALTHY® = Atekka + Opteamis « Scaylab - The entrepreneur coaching platform + WinSide + KOGEET - EHLeague - Sparkup  Et pour finir, un grand MERCI & toutes les équipes de Sirius Space Services qui permettent chaque jour de concrétiser notre mission et sans qui rien ne serait possible.  Tout simplement M+E*R-C+l @  Ce n’est que le début de notre aventure spatiale, alors embarquez avec nous pour écrire ensemble les prochains chapitres de notre histoire... sf”",https://www.linkedin.com/posts/sirius-space-services_neo-vivatech2024-spacetech-activity-7201964851714252801-LXyx?utm_source=share&utm_medium=member_desktop&rcm=ACoAAFsyZUYBH2tDEsbgneW-xiicuGyTwj5RqN8
Sirius Space Services,"eae  Like © Comment Repost  Sirius Space Services  fee 12.361 followers MME 20 cited © From 3 to 100 — Building the Future of together 3”  Every great journey starts with a bold vision... Ours began with three  of CORTIENES © 2 TEPOots  J Send  more  €€O 281 4 comments - 17 reposts  Like © Comment Repost  Sirius Space Services IEE 12,361 followers 10mo + Edited + ©  Cc  [News] - x #  Nous sommes fiers de faire partie intégrante du programme d  J Send   [CONTINUED_FROM_SCROLL]  BS 2m - Edited - @  From 3 to 100 — Building the Future of together 3°  Every great journey starts with a bold vision... Ours began with three passionate co- founders determined to make more accessible, sustainable and reliable.  What started as a vision has now become a thriving reality, powered by an exceptional team.  © Today, our has grown to over 100 talented individuals—experts, junior professionals, dreamers—who work every day towards a common mission: shape the future of and Space.  In just five years, we've turned this ambitious vision into concrete actions. From CAD design to first in-house productions, testing, and, most recently, the validation of our PDR—every step reflects our collective determination and commitment to this journey.  On this /, we want to shine a light on our incredible whose professionalism, resilience, and adaptability help us overcome every challenge and bring us closer to our first of in 2026.  The countdown continues—100 today, many more tomorrow. Join  © # Together, let's reach",https://www.linkedin.com/posts/sirius-space-services_space-space-spaceteam-activity-7305256211015200768-YFQC?utm_source=share&utm_medium=member_desktop&rcm=ACoAAFsyZUYBH2tDEsbgneW-xiicuGyTwj5RqN8
Sirius Space Services,"rr, rs FLEA 1261 followers 10mo + Edited» ©  [News] - Sirius Space Services X ACI GROUP x”  Nous sommes fiers de faire partie intégrante du programme MAGMA Tech & Factory d’ACI GROUP.  Cet accompagnement, nous permets notamment de concrétiser notre vision d'industrialiser la production de notre gamme de lanceurs, & seulement quelques  kilométres de Paris. lle  Ensemble, nous prouvons que le spatial peut étre & la fois innovant, compétitif et durable @  Ensemble, nous fagonnons l'avenir du spatial...  #  3 #  isJourney #LaunchSirius #SiriusSpaceSer\ \sSpace #SpaceFrance  Antoine Fourcade | Luc Lacoste | Philippe RIVIERE | Sebastien Lebel | Sébastien VERCRUYSSE  Show translation  ry Philippe RIVIERE ff - 3a  CEO ACI Groupe  tomo» ©  Le spatial made in France décolle (littéralement) chez ACI GROUP !  On a intégré le futur Space X francais.  Sirius Space Services fait partie de notre programme MAGMA Tech & Factory. Léquipe fondatrice cumule déja une grosse expérience dans le monde du spatial. Ce sont des passionnés, avec une appétence pour l'exploration et les défis diingénierie  Cette pépite construit des mini-lanceurs réutilisables qu'elle pourra envoyer bientét dans 'espace & une cadence élevée, grace a une technologie qui s‘apparente 4 impression 3D. Oui oui, de l'impression 3D... dans lespace !   [CONTINUED_FROM_SCROLL]  NmMOeNy  Le spatial made in France décolle (littéralement) chez ACI GROUP ! On a intégré le futur Space X francais.  Sirius Space Services fait partie de notre programme MAGMA Tech & Factory. Léquipe fondatrice cumule déja une grosse expérience dans le monde du spatial. Ce sont des passionnés, avec une appétence pour l'exploration et les défis diingénierie  Cette pépite construit des mini-lanceurs réutilisables qu'elle pourra envoyer bientét dans 'espace & une cadence élevée, grace a une technologie qui s‘apparente 4 impression 3D. Oui oui, de l'impression 3D... dans lespace !  Ils ont ajouté un défi de taille & leur projet : Comment accéder a I'espace de maniére plus durable.  Les fusées sont réutilisables et fabriquées prés de Paris. C'est un positionnement singulier dans le monde du spatial.  ACI GROUP est fier de les avoit accompagnement va leur permettre d'industrialiser la production des mini-  intégré a notre écosystéme. Notre  lanceurs made in France.  3 dates clés du projet & S1 2026 : vol inaugural de SIRIUS 1   S2.2026 : vol inaugural de SIRIUS 13, © Mi 2027 : vol inaugural de SIRUS 15  Et pour ambition de lancer une fusée par mois & partir de 2027 !  Alors, qu’en pensez-vous ? Pensiez-vous que le spatial pouvait étre durable ? Chez ACI GROUPE, on prouve que oui!  PS : en photo, Antoine Fourcade (CEO Sirius Space), Luc Lacoste (Head of Manufacturing Sirius Space) avec ’équipe Magma (Sébastien VERCRUYSSE / Sebastien Lebel) devant la maquette du moteur Sirius 1. Le spatial made in France est en marche !",https://www.linkedin.com/posts/sirius-space-services_le-spatial-made-in-france-d%C3%A9colle-litt%C3%A9ralement-activity-7217556354830364672-0v-W?utm_source=share&utm_medium=member_desktop&rcm=ACoAAFsyZUYBH2tDEsbgneW-xiicuGyTwj5RqN8
