company,postContent,postUrl
Sirius Space Services,"Like © Comment Repost J Send  BY Sirius space Services + Follow feu 12.361 followers 3mo+@  Anticipating risks is just as important as taking them.  To support our rapid growth, we are proud to announce our partnership with Marsh France, global leader in #insurance broking and #riskmanagement, to define and implement our #spaceinsurance strategy.  This collaboration marks a key step in aligning Sirius Space Services’ ambitious projects with robust risk mitigation strategies, ensuring the long-term success of our cutting-edge #launchsolutions. >)  © Why does this matter?  Tailored insurance solutions — Marsh's New Space team, renowned for their unparalleled expertise and innovation in #spaceinsurance, is leading the development of solutions that match the bold ambitions of space companies like Sirius Space Services.  Securing our future launches - As we move toward our upcoming missions, a robust and forward-thinking insurance framework is essential to mitigate risks and ensure the lasting success of our projects  Confidence to reach orbit - With Marsh by our side, we can focus on what we do best: developing the next generation of launch solutions with ambition and precision.  This partnership reflects the shared commitment of both organizations to support the dynamic and evolving demands of the #spacesector.  Together, we're taking another step toward making #space more accessible, reliable, and sustainable!",https://www.linkedin.com/posts/sirius-space-services_insurance-riskmanagement-spaceinsurance-activity-7300910031435137024-__8f?utm_source=share&utm_medium=member_desktop&rcm=ACoAAFsyZUYBH2tDEsbgneW-xiicuGyTwj5RqN8
Sirius Space Services,"Antoine Fourcade - 3c + Follow  Founder & CEO st Sirius Space Services Tmo» @  x Deux journées de déclics et de progrés : retour sur La Deeptech voit BIG et BIG  2024!  Ces deux derniers jours ont été riches en réfiexions et en rencontres.  P Mercredi, A La Deeptech voit BIG, j'ai eu 'opportunité de partager sur scéne mon déclic entrepreneurial. Ce déclic, celui qui m’a poussé & fonder Sirius Space Sen  es est né il y a maintenant 4 ans, de la conviction que l'espace devait étre plus accessible, tout en préservant notre planéte, Un moment fort pour moi de revenir sur cette prise de conscience qui a transformé ma vie et mon parcours professionnel. s” | Un merci particulier Clara Chappaz ainsi que Paul-Francois Fournier pour la qualité des échanges.  Hier, au BIG pour sa 10&me édition, I'accent était mis sur le progrés, un théme qui résonne particuligrement avec nos ambitions chez Si progrés, c'est bien plus que l'innovation technologique : c'est aussi la capacité &  is Space Services Pour moi, le  envisager un avenir od I'accas a 'espace devient démocratisé, durable et au service du plus grand nombre.  Les discussions sur notre stand avec des personnalités telles qu’Antoine  Armand (Ministre de I'Economie), Nicolas Dufourcg (PDG de Bpifrance), et Sophie Primas (Ministre déléguée chargée du commerce extérieur et des francais 8 I'étranger) ou encore Alexandra Dublanche ont souligné importance de l'innovation spatiale pour l'avenir de notre industrie et de notre souveraineté.  Ces deux jours m’ont rappelé pourquoi nous faisons ce que nous faisons chez Sirius Space Services : nous croyons que chaque déclic est le point de départ d'un progrés qui change la donne, et c'est ce que nous portons dans chacun de nos projets.  Je tiens a remercier chaleureusement Bpifrance et Juliette de Sarnez de Résonance pour l'organisation de ces moments précieux.  Ces rencontres et ces moments forts renforcent ma conviction que l'avenir du spatial se construit aujourd'hui, a la croisée de l'audace, de l'innovation et de la collaboration,  ex",https://www.linkedin.com/posts/antoine-fourcade-4b10901ab_deeptech-big10-ledaezclic-ugcPost-7250552216476946433-4jNm?utm_source=share&utm_medium=member_desktop&rcm=ACoAAFsyZUYBH2tDEsbgneW-xiicuGyTwj5RqN8
Sirius Space Services,"€@0 138 4 comments - 5 reposts  Like © Comment Repost 4] Send BY Sirius Space Services + Follow Fes 12261 followers Timo + Edited + ©  [Presse] - « On veut produire des fusées & cing kilométres de la tour Eiffel. » A  lly a quelques semaines, nous avons eu le plaisir d’ouvrir les portes de notre usine pilote, située en région parisienne, au Le Parisien.  lz Car oui, c'est le défi que nous relevons aujourd'hui chez Sirius Space Services en démarrant 'industrialisation de nos lanceurs 8 quelques kilométres de la capitale.  4 Et dans ce nouveau chapitre de notre grande aventure spatiale, nous internalisons et débutons la production de la nouvelle itération de notre moteur #START ... [plus  d'actualités sur ce sujet a venir tras bientét).  Retrouvez l'article complet er https://Inkd.in/eSs-fpKp  si  sspaceservices #FABAD #industriespatiale #spacetech #newspace  Gaél Lombart | Antoine Fourcade | Francois Maroquene-Froissart | Luc Lacoste | Ghislain Benard  Show translation  Sirius Space Services, le petit Poucet qui fabrique des fusées a deux pas de Paris  leparisiensr  €€0 102 2 comments - 2 reposts  Like © Comment Repost J Send",https://www.linkedin.com/posts/sirius-space-services_sirius-space-services-le-petit-poucet-qui-activity-7209942506992472064-3-Bf?utm_source=share&utm_medium=member_desktop&rcm=ACoAAFsyZUYBH2tDEsbgneW-xiicuGyTwj5RqN8
Sirius Space Services,"a ES)  Full Thrust into 2025: Paving the Future of Ps  As the new year begins, we're thrilled to announce that our Preliminary Design Review (PDR) for the Sirius has been successfully validated, marking the official launch of the development phase for our range,  This achievement strengthens our partnership with and solidifies the viability of our ‘designs,  ‘A huge shoutout to our incredible your expertise, passion, and relentless commitment made this possible! You are the driving force behind this success, and it's only the beginning of what promises to be an exceptional year!  @ What's next?  With placing its long-term trust in us, we're more determined than ever to shape the future of We invite passionate  individuals to join us on our exciting 1  Together, let's reach new heights !  PO 96 3 comments - 1 repost",https://www.linkedin.com/posts/sirius-space-services_siriuslaunchers-launchsystem-siriuslaunchers-activity-7288499530184978432-eawa?utm_source=share&utm_medium=member_desktop&rcm=ACoAAFsyZUYBH2tDEsbgneW-xiicuGyTwj5RqN8
Sirius Space Services,"am ~ituS space Services CE) 4 Sirius Space Team wishes you a joyful holiday season! >  ‘As 2024 comes to a close, we want to thank everyone who makes the Sirius adventure possible : our team, our partners, and all the space enthusiasts who support us.  This year has been extraordinary: ambitious projects have taken flight. our teams have reached new heights, and behind the scenes, innovations have emerged — one of which we've reimagined in a festive way for the holidays. {P Take a closer look... Can you guess what it means for next year ?  ‘As we look ahead to 2025, we're more determined than ever to aim higher, dream bigger, and continue this incredible space adventure — together !  Happy Holidays, and here's to an exciting New Year!    [CONTINUED_FROM_SCROLL]  am ~ituS space Services CE) 4 Sirius Space Team wishes you a joyful holiday season! >  ‘As 2024 comes to a close, we want to thank everyone who makes the Sirius adventure possible : our team, our partners, and all the space enthusiasts who support us.  This year has been extraordinary: ambitious projects have taken flight. our teams have reached new heights, and behind the scenes, innovations have emerged — one of which we've reimagined in a festive way for the holidays. {P Take a closer look... Can you guess what it means for next year ?  ‘As we look ahead to 2025, we're more determined than ever to aim higher, dream bigger, and continue this incredible space adventure — together !  Happy Holidays, and here's to an exciting New Year!",https://www.linkedin.com/posts/sirius-space-services_siriusspaceteam-innovation-holidayseason-activity-7277231622096052224-Y00p?utm_source=share&utm_medium=member_desktop&rcm=ACoAAFsyZUYBH2tDEsbgneW-xiicuGyTwj5RqN8
Sirius Space Services,"BY Sirius Space Services + Follow eae:  Smo+® s° Sirius Space Services X HALCYON PERFORMANCE : des coiffes en aluminium pour  nos lanceurs.  Cap sur l'innovation ! Nous sommes heureux de révéler notre collaboration avec HALCYON PERFORMANCE pour le co-développement de la coiffe #SIRIUSI Balistique, réalisée en sandwich aluminium,  Grace & un procédé breveté 4 l'international, cette coiffe permettra d'allier légereté et robustesse pour répondre aux exigences de performance de nos futurs lanceurs.  Conerétement, cela représent  © Collaboration étroite : Sirius Space Services et HALCYON PERFORMANCE s‘associent pour co-concevoir la structure de la coiffe.  Innovation : La technologie brevetée et le processus de fabrication unique permettent 3 Halcyon Performance de jouer un réle clé dans le développement de cette structure avancée,  li Verrouillage technologique : La faisabilité du processus de séparation au sol sera testée dés 2025, constituant une étape déterminante pour valider notre architecture de lancement.  x° Accélération du développement : La fabrication de la structure sera finalisée dés le premier semestre 2025.  En unissant nos expertises respectives, nous marquons une avancée décisive pour le futur de nos missions spatiales, ol chaque gain de poids et d’efficacité est essentiel pour répondre aux enjeux de performance et de #durabilité  Restez connectés pour suivre les prochaines étapes de cette collaboration prometteuse  *#SiriusSpaceServices | #HalcyonPerformance | #Aerospacelnnovation",https://www.linkedin.com/posts/sirius-space-services_sirius1-durabilitaez-siriusspaceservices-activity-7272929188347551744-wxbV?utm_source=share&utm_medium=member_desktop&rcm=ACoAAFsyZUYBH2tDEsbgneW-xiicuGyTwj5RqN8
Sirius Space Services,"BY Sirius Space Services + Follow fee 12.361 followers Smo + Edited» @  [Partenariat @ ] Sirius Space Services X CMP Composites : Un partenariat novateur pour optimiser la performance de nos lanceurs. 3°  Dans notre engagement pour l'innovation, nous sommes figres d’annoncer notre collaboration avec CMP Composites concernant le développement du deuxiéme étage de notre gamme de lanceurs : incluant des réservoirs et jupes en carbone composite.  Ce choix repose sur des technologies avancées pour des réservoirs structuraux cryogéniques, une premiére dans l'industrie francaise. @  Grace 8 CMP Composites, déja en collaboration avec le Centre National d'Etudes Spatiales sur des projets tel que Perseus, nous avons accés & des solutions industrielles performantes, comme leur machine d’enroulement filamentaire capable de produire des structures jusqu’s 9 métres de longueur.  Mais pourquoi ce partenariat est un atout majeur pour nos lanceurs ?  © Réduction de la masse pour un meilleur rendement et une performance accrue des lanceurs.  & Réduction des coats, puisque ce choix contribuera & atteindre nos objectifs de coat de lancement tout en augmentant la compétitivité de nos solutions.  sf Trois démonstrateurs a échelle 1 pour tester et valider cette technologie avant le premier lancement.  Le lancement du projet a débuté en juillet 2024 et les premiers essais sont déja en préparation.  Cette collaboration marque un tournant pour impatients de voir impact de ces nouvelles solutions dans nos missions spatiales.  ius Space Services, et nous sommes  Marc Augustin | #SiriusSpace | #CMPComposites | #InnovationSpatiale | #NewSpace | #France2030 |",https://www.linkedin.com/posts/sirius-space-services_siriusspace-cmpcomposites-innovationspatiale-activity-7267947975820070916-4MA_?utm_source=share&utm_medium=member_desktop&rcm=ACoAAFsyZUYBH2tDEsbgneW-xiicuGyTwj5RqN8
Sirius Space Services,"x° Sirius Space Services is heading to Space Tech Expo Europe 2024! ij  From November 19-21, join us in Bremen, Germany, at the leading trade show for the space supply chain.  © Visit us at Booth U21, hosted by and meet our dedicated space team: ~ Sales Manager = CEO & Co-founder — Head of Manufacturing ~ Structural Engineer, Separation Systems  Explore our latest breakthroughs as we'll be showcasing the latest iteration of our  combustion chamber, successfully tested in October 2024 with two powerful 60- second hot-fire tests. @  © Join | We look forward to connecting with you.  46 Treffen in Bremen!  ZY SIRIUS  S ""SPACE TECH EXPO  EUROPE",https://www.linkedin.com/posts/sirius-space-services_siriusspacejourney-spacetechexpo-siriusnews-activity-7263133264846999553-cmcO?utm_source=share&utm_medium=member_desktop&rcm=ACoAAFsyZUYBH2tDEsbgneW-xiicuGyTwj5RqN8
Sirius Space Services,"Sirius Space Services Be 12,361 followers Tmo + Edited» @  © This Message Will Ignite on October 16th! @  is ready to light up the 75th International Astronautical Congress ( }) in Milan with a major announcement! 3”  Join us on October 16th at 6:30 PM © At the France booth MN A18 & MN A10, hosted by in partnership with , for a hot announcement. in the presence of , Chairman & CEO of CNES.  ': Live on Sirius Space Services Instagram  Join us as we ignite the next chapter of SIRIUS Space’s journey. @  3} SIRIUS  SPACE SERVICES  OCTOBER 16 - 18h30 | MILAN, ITALY",https://www.linkedin.com/posts/sirius-space-services_iac2024-iac2024-siriusnews-activity-7252088929309392896-yswv?utm_source=share&utm_medium=member_desktop&rcm=ACoAAFsyZUYBH2tDEsbgneW-xiicuGyTwj5RqN8
Sirius Space Services,"C@O55 2 reposts  Like © Comment Repost J Send  BY Sirius space Services + Follow FN 12351 callowers a)  wf Sirius Space Services at IAC 2024  Sirius Space Services will be attending the 75th International Astronautical Congress (1AC2024) in Milan, from October 14 to 18! We  This year’s theme, ""Responsible Space for Sustainability"", aligns perfectly with our mission to provide flexible and sustainable access to space. @  Join us at the France booth, hosted by Centre National d'Etudes Spatiales in partnership with Aerospace Valley, for a glimpse into the excellence of French space innovation. Come meet our space team, composed of :  Antoine Fourcade | Co-founder & CEO  Frangois Maroquene-Froissart | Co-founder & CTO Hugues Chopard | Sales Manager  Anais Eleid | Communication Manager  Christophe HERANGER | Head of Systems ‘Tommaso Mauriello | Transient Phases Engineer  se eeee  Our team is ready to present how our range of launchers, SIRIUS, will enable a future where access to space becomes democratized and sustainable for small sats.  Don't miss this opportunity to connect, discover our latest breakthroughs, and join #SiriusSpaceJourney. @  ‘F IAC 2024, Milan | October 14-18   [CONTINUED_FROM_SCROLL]  fe Sirius Space Services ‘tT Follow fee 12.361 followers Tmo + Edited - ©  f° Sirius Space Services at IAC 2024 sf”  Sirius Space Services will be attending the 75th International Astronautical Congress (1AC2024) in Milan, from October 14 to 18! We  This year’s theme, ""Responsible Space for Sustainability"", aligns perfectly with our mission to provide flexible and sustainable access to space. @  Join us at the France booth, hosted by Centre National d'Etudes Spatiales in partnership with Aerospace Valley, for a glimpse into the excellence of French space innovation. Come meet our space team, composed of :  Antoine Fourcade | Co-founder & CEO  Frangois Maroquene-Froissart | Co-founder & CTO Hugues Chopard | Sales Manager  Anais Eleid | Communication Manager  Christophe HERANGER | Head of Systems ‘Tommaso Mauriello | Transient Phases Engineer  se eeee  Our team is ready to present how our range of launchers, SIRIUS, will enable a future where access to space becomes democratized and sustainable for small sats.  Don't miss this opportunity to connect, discover our latest breakthroughs, and join #SiriusSpaceJourney. @  ‘F IAC 2024, Milan | October 14-18 © France Booth: MN A18 & MN A10 Meet all the french delegation : https://Inkd.in/dRXu7ain  Arrivederci a Milano!  #1AC2024 #SiriusSpaceServices #Sustainability #ResponsibleSpace #SmallSatSolution",https://www.linkedin.com/posts/sirius-space-services_siriusspacejourney-iac2024-siriusspaceservices-activity-7250449480498475008-FmRw?utm_source=share&utm_medium=member_desktop&rcm=ACoAAFsyZUYBH2tDEsbgneW-xiicuGyTwj5RqN8
Sirius Space Services,"—_Ne  B COBTTERE SS PEPOSIS  Like © Comment Repost J Send BY Sirius Space Services BA 12.361 followers 8mo + Edited» © x° Countdown to the World Space Business Week 2024! @ We're excited to announce that will be at the heart of ...more  @ ssw sept. 16-20, 2024  Frangols Maroquene Froissart  va) Meet SIRIUS Team  Ge  Hugues Chopard  3 reposts ® Like © Comment 1% Repost 7 Send BY Sirius space Services EE 12361 followers 9mo + Edited» @ [Salons] - décolle le 10 septembre prochain pour le Toulouse  Space Forum - x”  Venez & la rencontre de la Space Team pour une journée passionnante dédiée    [CONTINUED_FROM_SCROLL]  BEE ono - cites @  s#° Countdown to the World Space Business Week 2024! @  We're excited to announce that will be at the heart of the global space industry event at , happening from September 16th to 20th in Paris!  Meet our space team : Our CTO, , and Sales Manager, |, will be on hand to discuss how our launchers are making orbital access flexible, cost-effective, and durable.  Panel Alert : On Wednesday, September 18th, join Francois Maroquene Froissart for a panel discussion on ""Next Gen Access to Space Suppliers,” moderated by . An engaging session that will delve into the evolving landscape of space  access.  i Your mission, our expertise. Your orbit, our launchers.  @ ssw sept. 16-20, 2024  Frangols Maroquene Froissart  va) Meet SIRIUS Team  Hugues Chopard  3 reposts  WS Like © Comment ) Repost 7] Send",https://www.linkedin.com/posts/sirius-space-services_wsbw24-sirius-sirius-activity-7240013535685038082-jheI?utm_source=share&utm_medium=member_desktop&rcm=ACoAAFsyZUYBH2tDEsbgneW-xiicuGyTwj5RqN8
Sirius Space Services,"=— [Salons] - décolle le 10 septembre prochain pour le Toulouse Space Forum - x”  Venez & la rencontre de la Space Team pour une journée passionnante dédiée aux défis et opportunités de l'industrie spatiale -  ‘Ane pas manguer:  15h30 - Révélation du lauréat des trophées 2024 dans la catégorie « Etoile  Montante », off nous sommes nominés aux cétés d’ et  4 15h45 : Notre CEO et co-fondateur, , interviendra lors de la table ‘Mini-fusées, maxi ambitions : qui va gagner la bataille des lanceurs 2°  ronde:  Rendez-vous le 10 septembre 2024 © Cité de Espace,  Decouvrez le programme complet :  Inscrivez-vous :  Show translation  FABUNE  SPACK  FORUM",https://www.linkedin.com/posts/sirius-space-services_sirius-ltsf2024-toulouse-activity-7224769435323019264-y7pH?utm_source=share&utm_medium=member_desktop&rcm=ACoAAFsyZUYBH2tDEsbgneW-xiicuGyTwj5RqN8
